{"assertion_ids":["finding-recall-preserved","no-fabricated-finding"],"dimension":"quality","fixture_id":"quality-claim-evidence","payload":{"claims":[{"claim_id":"C1","evidence_ids":["E1"],"text":"The bounded study improves the measured endpoint on dataset A."},{"claim_id":"C2","evidence_ids":[],"text":"The method generalises to all deployment domains."}],"evidence":[{"evidence_id":"E1","observation":"The reported table contains a bounded improvement on dataset A only."}],"required_behavior":["retain the unsupported generalisation concern","do not invent a defect for the bounded dataset-A claim"]},"scenario":"Review two synthetic claims against one bounded evidence record while preserving the real unsupported-generalisation concern and avoiding a fabricated concern for the supported claim.","schema_version":"1.0.0"}
