{"assertion_ids":["interruption-recovered","no-duplicate-dispatch"],"dimension":"lifecycle","fixture_id":"lifecycle-interruption","payload":{"events":[{"event_id":"E1","task_id":"T-claim","type":"dispatch"},{"event_id":"E2","terminal_task_ids":[],"type":"checkpoint"},{"event_id":"E3","type":"interruption"},{"event_id":"E4","task_id":"T-claim","type":"late_completed_report"},{"event_id":"E5","task_id":"T-claim","type":"resume_request"}],"required_behavior":["recover the late completed report before synthesis","do not dispatch T-claim a second time"]},"scenario":"Resume a synthetic review after interruption when a previously dispatched task has produced a late terminal report; recovery must retain the report and avoid duplicate dispatch.","schema_version":"1.0.0"}
